{
  "schemaVersion": 2,
  "productId": "cortex",
  "displayName": "Cortex",
  "productVersion": "1.0.0",
  "hubCompatRange": ">=0.1.0",
  "installRoot": "/tmp/cortex",
  "serviceStart": ["/tmp/cortex/bin/cortex"],
  "serviceStop": [],
  "icon": "/tmp/cortex/icon.png",
  "artifactDigest": "sha256:aaaaaaaaaaaaaaaaaaaaaaaaaaaaaaaaaaaaaaaaaaaaaaaaaaaaaaaaaaaaaaaa"
}
